"Nombre","Direccion","Descripcion","Tipo de acceso","Tipo de Patrimonio","Grupo","Componente","Elemento","Georefenciacion","Tipo Propiedad"
"Mercado Público de Santa Cruz de Lorica","Carreras 19 y 21A con calles 1 y 4","Declarado Monumento Nacional en 1996 siendo la más emblemática de las edificaciones del municipio. Dado el carácter de emporio comercial de Lorica por la época de su construcción en 1929 el mercado público se constituyó en un sitio estratégico para el comercio porque por allí entraba toda la mercancía de la región y se cargaba la que salía desde el puerto en todo tipo de embarcaciones con fines comerciales. A finales del Siglo XIX el mercado funcionaba en una construcción rústica conocida popularmente como El Ranchón. La construcción actual en mampostería con cubierta de zinc fue levantada en 1929 por gestión del cura Lácides C. Bersal. Lo conforman cuatro fachadas dos mayores una sobre el Río Sinú y la otra sobre la calle 1 simétricas cada una con quince arcos rebajados y 16 columnas rematadas por un ático con balaustrada en cemento que cuenta con un frontón decorado y un emblema en el que se lee “Mercado Público” en alto relieve. Desde la creación de la red ferroviaria y de carreteras el río perdió importancia como canal de comunicaciones y debido a ello el mercado pasó a ser lugar de venta de artesanías comida típica aliños granos y especias.","Terrestre","Patrimonio cultural material inmueble","Grupo arquitectónico","Arquitectura institucional","Arquitectura para el comercio","9.225900  -75.818300","Pública"
"Mural del Puerto","Calle 1 con Carrera 16 - Esquina","Mural en cerámica de arcilla industrializada tipo relieve de 8 mts de ancho por 125mts de alto. Ubicado sobre el Malecón del Sinú y construido por escultor loriquero Adriano Ríos Sossa. Cuenta la historia de Santa Cruz de Lorica de los últimos años recreando mediante el arte hechos relevantes situaciones cotidianas y apartes de la historia como la fábrica de jabones El Angelito y el jarabe de la Farmacia León los almacenes árabes y las tiendas de judíos como se les denominaba. Están recreados el médico y etnólogo de reconocido Manuel Zapata Olivella y un poema de su sobrino Alexis Zapata que le rinde homenaje. A su lado el doctor Díaz Díaz lleva en la mano una carpeta de abogado anunciando que el progreso le ha salido caro a Lorica pues precisamente a partir de las nuevas carreteras y de la creación del departamento esta ciudad próspera de principio de siglo fue quedando vacía y rezagada entre otros sucesos históricos que marcaron a Lorica.","Terrestre","Patrimonio Cultural Mueble","Obras en espacio público","Relieve","Relieve","9.226600  -75.819900","Pública"
"Palacio de las Trece Columnas","Calle 4 No. 18-19","Su construcción se inició a finales del Siglo XIX en 1880 bajo el mandato del alcalde Juan Burgos Villadiego y se completó en 1915 cuando era alcalde Joaquín Prioló. Tiene forma rectangular en su planimetría con una altura de un piso. Como su construcción se inició antes de que existiera el sector amurallado en el Río Sinú (conocido inicialmente como la muralla) el nivel del  piso es mayor que el de la calle para protegerla de las inundaciones. Conocido tradicionalmente como Palacio de las Trece Columnas donde antes funcionó la Alcaldía Municipal  la Cárcel Municipal y estación de policía y hoy es sede del Concejo Municipal de Lorica.","Terrestre","Patrimonio cultural material inmueble","Grupo arquitectónico","Arquitectura institucional","Edificación gubernamental","9.228200  -75.818200","Pública"
"Parque Lácides C. Bersal","Carrera 18 con diagonal 3 - Esquina","Antes llamado “Parque La Fraternidad” hoy lleva el nombre de Lácides C. Bersal fue rebautizado con este nombre en los años 60 en honor al sacerdote considerado como ilustre hijo adoptivo de Lorica quien tuvo a su cargo la remodelación de la Iglesia la construcción del Mercado Público y la residencia de doña Ana Clara Bersal Rossi demolida en los años 70. Con un área de 562 M2 lo separa de la iglesia la calle peatonal denominada “Paseo Bersal”. Este parque fue integrado desde el año 2016 en el proyecto de recuperación paisajística de integración de parques y plazas siendo objeto de remodelación y dotándolo de obras de urbanismo jardinería y adoquinamiento de andenes y demás elementos del espacio público. Posee alto valor estético por su tipología y acabados arquitectónicos.","Terrestre","Patrimonio cultural material inmueble","Grupo urbano o rural","Elementos del espacio público","Parque urbano","9.227100  -75.819000","Pública"
"Parque Simón Bolívar","Calle 1 entre carreras 17 y 18","También se conocido como &acuteParque o Plaza Central&acute. Limitado por la Iglesia edificio Moisés Jattin casa Berenice de Pardo edificio González edificio de comercios la Isla casa de Humberto Martelo y parque Lácides C. Bersal todas edificaciones de comienzos del Siglo XX con arquitectura republicana que poseen valor estético por su tipología y los acabados arquitectónicos muchos de ellos aun conservados en el tiempo. Fue construido en la década de los años 50 del Siglo XX posee un área de 500 m2 y se levantó sobre la plaza del mismo nombre en la que hacia 1937 se realizaban las famosas corralejas que posteriormente fueron trasladadas a la plaza de Santa Teresita. Ha sido remodelado en tres ocasiones. En uno de sus extremos está localiza la estatua a Simón Bolívar instalada en 1994. Es un espacio abierto que simula una plazoleta con arborización lateral y bancas. Es un importante para locales y turistas ya allí se encuentra el atrio de la Iglesia Central y es el sitio de encuentro de eventos culturales y recreativos de alta convocatoria. Después de la última remodelación en 2017 se instalaron bancas bolardos un sistema de pérgolas que ayudan a aliviar el calor del sol canecas de basura y señalización.","Terrestre","Patrimonio cultural material inmueble","Grupo urbano o rural","Elementos del espacio público","Parque urbano","9.226600  -75.819300","Pública"
"Puente 20 de Julio","Carrera 21 entre calles 5 y 6 C","Conocido también como “Puente Viejo” cuya construcción se dice que inició a finales del Siglo XIX para comunicar el sector histórico y señorial con el resto de la “nueva ciudad” que crecía en forma lineal a lo largo del camino real de los populares barrios de Arenal y San Pedro. Finalizada su construcción se inauguró en el año 1910 lo que resultaría en un puente aporticado de estilo republicano con catorce arcos de medio punto sobre el caño Chimalito con altos valores estéticos que permitía el cruce y tránsito de personas carruajes y animales hasta el Centro Histórico. Hoy día está adoquinado en sus 120 metros de longitud y 3 metros de ancho.","Terrestre","Patrimonio cultural material inmueble","Grupo arquitectónico","Obras de ingeniería e infraestructura","Otro","9.229200  -75.816700","Pública"
"Ciénaga de Bañó","Zona rural del municipio","La Ciénaga de Bañó es un humedal de 326ha declarado como Distrito de Conservación de los Suelos en el año 2013. Este lugar permite desarrollar procesos de conservación de especies como los huevos del pato pisingo y la liberación de hicoteas o tortugas de agua y a su vez es un área importante para la conservación de las aves en los Andes Tropicales  por lo que obtuvo el primer puesto en el Censo Nacional de Aves Acuáticas al tener el mayor número de especies registradas. La ciénaga está enriquecida por un ecosistema apreciable de plantas acuáticas como tarulla y verdolaga arboles como ceiba y camajón peces como bocachico y mojarra aves nativas y migratorias como chavarrí y gavilán especies de réptiles como babilla e iguana  y mamíferos como oso hormiguero y ardilla.","Terrestre","Áreas protegidas","Áreas con declaratorias departamentales","Áreas con declaratorias departamentales","Áreas con declaratorias departamentales","9.136800  -75.818300","Pública"
"Ciénaga Grande de Lorica","Zona rural del municipio","Por su extensión (38.000 hectáreas totales y 12.000 en verano) es uno de los humedales más importantes en toda la cuenca del Río Sinú en el Departamento de Córdoba. Con 12.000ha en Lorica al interior se encuentra una asociación de varios cuerpos de agua transitoria y permanente. El ecosistema alberga el 46% (182 especies) de la población de aves registradas en Córdoba (396 especies). Debido a la gran riqueza de aves que el ecosistema mantiene y siendo el más importante de los humedales que tiene la cuenca del Río Sinú ha sido reconocido como área de importancia para la conservación de aves (AICA). La profundidad va de 4.5 a 5.5 metros. La ciénaga involucra también los municipios Purísima Momil Chimá y Cotorra. Su función amortiguadora del nivel del río en la época lluviosa de abril a noviembre evita las inundaciones excesivas el enriquecido entorno ecológico que se forma gracias al intercambio de aguas entre ecosistemas de tipo léntico (las lagunas) y lótico (el río) la convierten en un hábitat que alberga gran variedad de fauna y flora. Estas aguas históricamente han sido aprovechadas por los habitantes sinuanos que han desarrollado toda una economía de pesca y comercio a su alrededor. En 2007 fue objeto de declaratoria como Distrito de Manejo Integrado por parte de la CVS autoridad ambiental.","Terrestre","Áreas protegidas","Áreas con declaratorias departamentales","Áreas con declaratorias departamentales","Áreas con declaratorias departamentales","9.221300  -75.778400","Pública"
"Río Sinú","Calle 1 entre carrera 9 y 22","El Río Sinú nace en el Nudo de Paramillo en el departamento de Antioquia desembocando en Boca de Tinajones municipio de san Bernardo del Viento en el mar Caribe. Por su dinámica hidrobiológica es considerado entre los más fértiles del mundo. Históricamente el río ha convertido al municipio en el puerto comercial más importante del bajo Sinú. Desde la Conquista era por donde ingresaba la carga y mercancías desde Cartagena con destino al interior del país y a la vez salía el avituallamiento los productos del campo y el oro producto del despojo a que fue sometida la población indígena durante la ocupación española. El Sinú recorre el municipio en 48 kilómetros aproximadamente atravesándolo de sur a norte desde Cotocá hasta La Doctrina y dividiéndolo en dos grandes áreas: Margen Izquierda y Margen Derecha. Un sitio de pesca natural de especies como el bocachico y el bagre. Actualmente no se cuenta con actividades para el disfrute turístico del río.","Terrestre","Aguas lóticas","Río","Río","Río","9.226600  -75.815300","Pública"
"San Sebastián","Zona rural del municipio","San Sebastián de Urabá es un poblado de pescadores de la zona rural que bordea la Ciénaga Grande de Lorica. Centro de artesanos alfareros cuyas artesanías se caracterizan por ser elaboradas en arcilla (barro) tales como tinajas animales (gallinas –especialmente la guinea o “cocá”– hicoteas) jarras y alcancías. Entre los artesanos destaca la familia del pintor primitivista Marcial Alegría de reconocimiento mundial cuyas obras han sido expuestas en países como Alemania Italia Francia y Suiza como él mismo muestra los recortes de periódico que registran su fama. Se puede encontrar en su taller que lo registra bajo el letrero “Centro Cultural Primitivista Marcial Alegría”. El corregimiento celebra anualmente las festividades del 12 al 14 de octubre cuyo objetivo es mostrar la calidad de la producción artesanal de sus alfareros donde también participan artesanos de las otras poblaciones que hacen parte de la Ciénaga Grande. Además hay presentación de grupos musicales muestra de artesanía infantil y concursos de habilidad en canoas y atarrayas para los pescadores.","Terrestre","Patrimonio cultural material inmueble","Grupo urbano o rural","Sector urbano o rural de interés","Sector urbano de interés","9.226800  -75.788900","Pública"
"San Nicolás de Bari","Zona rural del municipio","Desde el año 1398 hasta 1545 fue habitado por resguardo indígena de Zenúes cuya lengua materna era la guajiba. Durante el año 1700 el resguardo recibió la visita de una embarcación proveniente de Italia con tres santos: San Bernardo del Viento San Sebastián y San Nicolás de Bari que apadrinaron un pueblo diferente cada uno de ellos. Actualmente la mayoría de las casas son de bareque con techo de palma y una mínima parte de material. La iglesia tiene la imagen de San Nicolás la virgen de la Candelaria un Cristo traído por los españoles durante la época de la colonia y una campana marcada especialmente para San Nicolás con fecha de 1794 además hay un sitio llamado La Peña de las Guacamayas del que se dice es el lugar más peligroso del Rio Sinú por sus remolinos asociado al mito del canto de las guacamayas como le ocurrió al vapor Sinú que naufragó. En este lugar los hermanos Pedro y Alonso de Heredia dejaron un fuerte militar hacia el año 1536. Se conservan hallazgos arqueológicos por parte de la comunidad catalogados y almacenados en vitrinas. Existe una marcada tradición indígena local en las artesanías a base de la hoja de enea (planta que nace en los humedales) representada en la elaboración de las tradicionales esteras y petates la cual ha permanecido durante más de 400 años y cada día se ha ido perfeccionando y diversificando y hoy se elaboran bolsos y carteras que son comercializados especialmente por fuera del municipio.","Terrestre","Patrimonio cultural material inmueble","Grupo urbano o rural","Sector urbano o rural de interés","Sector urbano de interés","9.247400  -75.881600","Pública"
"Centro Parroquial Pío XII","Carrera 18 No. 2 - 49","Edificado en dos plantas después de la iglesia en el callejón del antiguo cementerio en un terreno del que se dice se apropió el padre Lácides C. Bersal a nombre de la Iglesia que comunica las calles 17 y 18. Posee un espacio libre central enriquecido con columnas y arcos de medio punto que se comunica con todas las dependencias la casa cural y el atrio de la iglesia por el costado de la calle 17 fue construido con bloques en el sistema de muros de carga y columnas piso en mosaico de baldosa y reconstruido posteriormente cambiando la cubierta a teja de asbesto cemento. Actualmente presta sus servicios como la Casa Cural de iglesia principal.","Terrestre","Patrimonio cultural material inmueble","Grupo arquitectónico","Arquitectura religiosa","Conjunto parroquial","9.227200  -75.818900","Privada"
"Edificio Comercial Berenice Sotomayor de Pardo","Calle 1 No. 16 A - 96","Originalmente Banco Comercial Antioqueño data de 1957 y el estilo arquitectónico es moderno rompiendo el esquema republicano existente alrededor del parque central. Es un cuadrado en el que existe un entrepiso o mezzanine que le da doble altura a la primera planta para un total de tres pisos. Por su uso para atención al público las columnas se ubican estratégicamente dejando un amplio espacio interior. La fachada es en vidrio de acuerdo con el estilo arquitectónico conocido como “piel y hueso” de Mies Van de Rohe que se caracteriza por lo majestuoso. En el segundo piso el estilo se aleja de lo transparente que le da el vidrio a la primera planta con un balcón cubierto pero se mantiene la ventanería de vidrio para no romper con el equilibrio en la fachada. Se observa dividido en dos locales comerciales tipo supermercado con publicidad externa.","Terrestre","Patrimonio cultural material inmueble","Grupo arquitectónico","Arquitectura institucional","Arquitectura para el comercio","9.226600  -75.819300","Privada"
"Edificio Edilberto López","Calle 2A No. 20 - 06","Edificación de dos plantas que data del siglo XIX aunque fue remodelada en 1945. En el primer piso funcionan locales comerciales y en el segundo funcionaba la vivienda hoy convertida en bodega. Esquinero presenta un balcón corrido en cada una de las dos fachadas y en una de ellas un balcón dividido en dos que sugiere que no es la fachada original. En la primera planta unas arcadas de medio punto en una de las fachadas y en la otra fueron reemplazadas por columnas y vigas puertas y ventanas. El alero en concreto lo sostienen cartelas decorativas y estructurales a la vez. El frontis oculta la cubierta en zinc. Se encuentra pintado pero ha perdido los valores patrimoniales del primer piso excepto el piso en baldosa de cemento del corredor. El bien inmueble fue incluido entre los que hacen parte de la declaratoria de patrimonio del centro histórico por el Ministerio de Cultura.","Terrestre","Patrimonio cultural material inmueble","Grupo arquitectónico","Arquitectura habitacional","Vivienda urbana","9.226900  -75.817600","Privada"
"Edificio Ubaldo López","Calle 1 No. 16 A - 14","Inicialmente era el Edificio Lequerica que data de 1950. De dos plantas donde primero funcionó una piladora de arroz en la primera planta y la segunda era residencial como en la mayoría de bienes inmuebles del centro histórico. Ocupa toda una esquina por lo que consta de tres fachadas: frontal lateral y posterior esta última da al frente del río Sinú. Se destaca por sus balcones y su fachada de color blanco y vino tinto. Las ventanas son arcos de medio punto y si bien algunos elementos de las fachadas fueron cambiados por acabados más modernos la morfología y tipología de la edificación fue respetada por quienes hicieron las remodelaciones. Hoy en día fue recuperada la parte trasera de la edificación producto de las obras de urbanismo realizadas en el malecón. En la primera planta funciona un almacén de insumos agropecuarios y ha sido embellecido con un pequeño jardín de plantas en macetas. El bien inmueble fue incluido entre los que hacen parte de la declaratoria de patrimonio del centro histórico por el Ministerio de Cultura.","Terrestre","Patrimonio cultural material inmueble","Grupo arquitectónico","Arquitectura habitacional","Vivienda urbana","9.226300  -75.819900","Privada"
"Mural del Palacio Municipal","Calle 1 Bis # 17 - 54","Mural construido por el artista Adriano Ríos Sossa nativo de Lorica. Está ubicado en el Edificio González actual Alcaldía de Santa Cruz de Lorica en una pared lateral del patio central mural fabricado en barro. Cuenta de manera cronológica la historia de los principales acontecimientos que han marcado el devenir del municipio desde los indígenas pasando por la llegada de los españoles la traída de los primeros negros para ser esclavizados hasta la llegada de los primeros inmigrantes sirio-libaneses en la década de 1880. Este mural está construido por pequeñas piezas que arman un rompecabezas de alto valor artístico y patrimonial de 2mts de alto por 10mts de largo.","Terrestre","Patrimonio Cultural Mueble","Obras en espacio público","Relieve","Relieve","9.227100  -75.818700","Pública"
"Mural de la Casa de la Cultura","Calle 4 No. 18-12","Obra del artista local Adriano Ríos Sossa que se suma al mural del puerto al que se encuentra en el Palacio Muncipal y en el Palacio de las Trece Columnas. Se encuentra en las fachadas esquineras de la Casa de la Cultura con dos módulos de un lado y tres sobre el otro. De derecha a izquierda en sus dos primeros módulos muestra el devenir de la historia local empezando desde los asentamientos Zenúes y la llegada de los españoles continuando con las construcciones significativas como la iglesia puentes el palacio municipal fábricas y la llegada de los inmigrantes sirio libaneses que se asentaron en el municipio. En los siguientes tres módulos se muestra la urbanización de la ciudad en el siglo XX el aeropuerto el movimiento portuario festividades populares como las corralejas la actividad industrial la agitación y violencia política como también proyectos más recientes como la pavimentación del casco urbano y la planeación municipal. De varios tonos en color rojizo tal como queda el barro al secar.","Terrestre","Patrimonio Cultural Mueble","Obras en espacio público","Relieve","Relieve","9.228200  -75.818500","Pública"
"Casa de la Cultura","Calle 4 No. 18-12","Denominada “Eugenio Sánchez Cárdenas” la Casa de la Cultura fue construida en 1977 y su nueva sede reconstruida en 1983 proyecto del arquitecto Fabio Corrales. La construcción estuvo a cargo del ingeniero Herbert Kerguelen realizado con el apoyo del Instituto Colombiano de Cultura – COLCULTURA cuando el área de la cultura estaba a cargo del Ministerio de Educación. La Casa de la Cultura celebró sus bodas de plata en el año 2002 tal como reza una tablilla en la entrada. Sus instalaciones constan de un auditorio biblioteca sala de lectura salas de música y artes plásticas además de la administración y servicios. Actualmente se encuentra cerrada y desocupada. En su fachada se construyó un importante mural en arcilla cerámica a cargo del reconocido artista loriquero Adriano Ríos Sossa y se inició la siembra de un jardín vertical sin embargo este ya no existe. Fue escenario de exposiciones conferencias tertulias foros y encuentros que han servido no solo a los loriqueros sino también para los visitantes.","Terrestre","Patrimonio cultural material inmueble","Grupo arquitectónico","Arquitectura institucional","Edificación para la cultura","9.228200  -75.818500","Pública"
"Mural del Palacio de las Trece Columnas","Calle 4 No. 18-19","Mural que plasma con el barro traído de la Ciénaga Grande del Bajo Sinú las tradiciones de la región como la pesca la ganadería la agricultura la fiesta en corraleja las leyendas y el arte de la cerámica heredada de los indígenas Zenúes y conservada en San Sebastián un reconocido corregimiento ubicado a cinco kilómetros de Santa Cruz de Lorica donde parte de la población se dedica a la artesanía de barro y la alfarería. Es otro de los murales del artista Adriano Ríos Sossa considerados como una muestra clara de la narrativa histórica de Santa Cruz de lorica producto de la oralidad transmitida de generación en generación por los abuelos cuando el artista se traslada a comunidades como San Sebastián de Urabá o San Nicolás de Bari para conocer procesos como la técnica del barro cocido o investiga en los archivos históricos y fotográficos para conocer apartes de las épocas de la Conquista o la Colonia estableciendo imaginarios colectivos que para ilustrar sus imágenes. Investigadores como Juan Doria sitúan al artista a la altura de Débora Arango o Pedro Nel Gómez quienes toman la vivencia de su cultura y las inmortalizan a través del arte. Algunos de sus elementos constitutivos han sido objeto de las inclemencias del tiempo donde el agua lluvia ha manchado de negro el mural y deteriorado objetos del relieve como cuernos y vasijas.","Terrestre","Patrimonio Cultural Mueble","Obras en espacio público","Mural","Mural","9.228200  -75.818200","Pública"
"Mural de los Escritores","Calle 4 con carretera Troncal - esquina","Mural en piezas de cerámica de 20 x 20 centímetros a todo color que refleja pasajes de la vida y obra de los importantes escritores loriqueros como Manuel Zapata Olivella y David Sánchez Juliao destacándose dos personajes creados por este último como El Pachanga y El Flecha de los cuales se muestran algunas imágenes de ellos y relativas al entorno en que se movían los personajes. También se muestran aspectos del territorio como los caimanes del río pájaros y aves y ecosistema de manglares aunque este último no es propio del territorio del municipio.","Terrestre","Patrimonio Cultural Mueble","Obras en espacio público","Mural","Mural","9.227100  -75.814800","Pública"
"Edificio Pilador Lorica","Calle 1 No. 21 - 02","Data de 1950 conocido como el Pilador Sansón. Esquinero consta de una edificación de una planta en forma de vivienda adosada a una edificación de una planta que muestra una bodega y una torreta de tres pisos que en su interior alberga los equipos de pilado. Su uso era industrial y su objetivo era el procesamiento del arroz a través del pilado que es cuando se le quita la cáscara al grano. Cuando dio inicio en 2005 al proceso de recuperación del Centro Histórico de Lorica se propuso el proyecto “Centro Comercial Patios del Pilador” para trasladar y reubicar a 220 vendedores estacionarios informales pero después de varias reuniones de concertación no fue aceptado. La edificación actualmente se encuentra abandonada.","Terrestre","Patrimonio cultural material inmueble","Grupo arquitectónico","Arquitectura institucional","Arquitectura para la industria","9.225800  -75.823700","Privada"
"Plaza de la Concordia","Entre carreras 18 y 19 con calle 2 A","Levantada en un terreno cedido en su momento a finales del Siglo XIX por los hermanos Martínez Sossa terratenientes de la región. Está enmarcada por tres grandes y significativos edificios de arquitectura republicana como el Josefina Jattin de Manzur el Fernando Usme Alarcón y el de los sucesores de Julia Jattin Jattin junto con otras edificaciones menos representativas y consideradas no patrimoniales. Con un área de 1200 M2 fue donde inicialmente se exponían artesanías de la región. En 1958 se instaló el busto del señor Gabriel Martínez Sossa benefactor del municipio y uno de quienes donó el terreno donde está la plaza. Mantiene su importancia histórica y en el pasado fue utilizada como sitio de exposición de artesanía local. Actualmente es un lugar netamente comercial donde se presenta ocupación del espacio público en sus alrededores.","Terrestre","Patrimonio cultural material inmueble","Grupo urbano o rural","Elementos del espacio público","Plaza","9.226900  -75.818200","Pública"
