"Nombre","Direccion","Descripcion","Tipo de acceso","Tipo de Patrimonio","Grupo","Componente","Elemento","Georefenciacion","Tipo Propiedad"
"Plaza del Pastelillo","Calle 1 Bis con carreras 19 y 20 A","La plaza del Pastelillo es de un área reducida de unos 140 M2. Si bien es una pequeña plazoleta siempre se le ha denominado como Plaza desde mucho antes de la construcción del edificio Afife Matuk que se encuentra frente a ella por ser un sitio que servía de atracadero de embarcaciones y chalupas que navegaban el río. Ha sido objeto de embellecimiento y urbanismo encontrándose señalizada arborizada con materas bancas y canecas de basura. Cuenta con un mirador hacia el río Sinú y un espacio para embarque directo en el río. Es un punto de encuentro permanente de la comunidad. Hace parte del área del centro histórico objeto de declaratoria de patrimonio por parte del Ministerio de Cultura.","Terrestre","Patrimonio cultural material inmueble","Grupo urbano o rural","Elementos del espacio público","Plazoleta","9.226000  -75.818300","Pública"
"Busto de Enrique Olaya Herrera","Calle 1 con carrera 16","Erigido por el Concejo en febrero 9 de 1968 siendo alcalde Carlos Calao Pérez como parte del homenaje al que fuera presidente de la República de quien se conserva una calle también con su nombre justo donde está ubicado el busto. Es una figura en mármol de unos 60 cmts de alto ubicada sobre un pedestal de granito de 1.20 mts aproximadamente en que se observa al homenajeado con la banda presidencial y el escudo nacional con una mirada hacia el frente como mirando al horizonte.","Terrestre","Patrimonio Cultural Mueble","Obras en espacio público","Busto","Busto","9.226500  -75.820300","Pública"
"Busto de Gabriel Martínez Sossa","Calles 2 y 2 A con carreras 18 y 19","Construido en piedra de mármol pulido montado sobre un pedestal también de este mismo material. En sus cuatro caras rezan las siguientes leyendas: “Lorica a la memoria de su dilecto hijo GABRIEL MARTÍNEZ S” “Honrar el mérito es la más bella forma de ser justo” “El pueblo que honra a un hijo distinguido sólo se honra a sí mismo” y “Deseo que mis huesos reposen para siempre en esta tierra cara a mi corazón si muero ausente de ella pido a mis amigos los repatríen. Gabriel Martínez S”. Ubicado en la Plaza de la Concordia terreno cedido a finales del Siglo XIX por la familia Martínez Sossa.","Terrestre","Patrimonio Cultural Mueble","Obras en espacio público","Busto","Busto","9.227900  -75.822000","Pública"
"Busto de Jesús María Lugo","Carrera 17 con calle 4","De color café ubicada sobre un pedestal de piedra y mármol. Fue levantada en honor del General Jesús María Lugo en el separador central de la avenida del mismo nombre que además fue el primer tramo en doble calzada del municipio de Lorica. En su placa en mármol se lee: “Lorica a un noble y generoso hijo suyo que hizo del valor la prudencia y el patriotismo el tema de su meritoria vida. Al general Jesús María Lugo. 1959 – 1927”.","Terrestre","Patrimonio Cultural Mueble","Obras en espacio público","Busto","Busto","9.228100  -75.819100","Pública"
"Reloj de Sol","Carrera 25 con diagonal 8 en la carretera Troncal","Consiste en una placa de concreto de 80 centimetros de ancho por 2 metros de alto inclinado unos pocos grados antes de la verticalidad total. En su parte superior están marcadas las horas del día de 6 a 6 con subdivisiones cada media hora que va marcando la sombra que da el sol de acuerdo con su movimiento sobre la bóveda celeste. Por el lado frontal marca durante las horas de la mañana y por el trasero durante la tarde. Enmarcada en un pequeño espacio circular demarcado con doce bolardos pequeños de unos 50 centimetros de alto para garantizar su aislamiento y significado y éstos a su vez dentro de un área delimitada por andenes en concreto y bolardos de acceso al andén.","Terrestre","Patrimonio Cultural Mueble","Obras en espacio público","Reloj","Reloj","9.231900  -75.814500","Pública"
"Caño Aguas Prietas","Pasa por nuestro municipio","Investigaciones realizadas sitúan los orígenes del Caño Aguas Prietas hace unos 50 mil años en el período Pleistoceno siendo el lugar por donde primero corrió el Río Sinú antes de ocupar su actual cauce. El color oscuro o “prieto” de sus aguas resultado de la materia orgánica del suelo lodoso le dio el nombre actual. Hoy es lo que queda de la antigua comunicación lagunar por el bajo Sinú a través de la Ciénaga Grande desde el municipio de Lorica comunicándose con Ciénaga de Oro Chimá Momil y Purísima por donde entraban y salían barcazas de comercio con Cartagena y el resto de la costa Caribe. Sigue siendo un lugar de pesca pero los locales han visto desaparecer especies como hicoteas babillas manatíes o ponches.","Terrestre","Aguas lóticas","Arroyo o riachuelo","Arroyo o riachuelo","Arroyo o riachuelo","9.226600  -75.815900","Pública"
"Caño Chimalito","Carrera 17 con carrera 25","Presenta agua permanente durante la estación de invierno cuando la ciénaga de Juan Lara donde nace le introduce agua y mantiene corriente constante. En el tramo que atraviesa el municipio especialmente a ambos lados del puente 20 de Julio durante todo el año presenta un fenómeno propio del caño que tiene que ver con la presencia de las plantas acuáticas conocidas como buchón o tarulla que prácticamente cubren la superficie del agua en el tramo en el sector mencionado causadas por la constante presencia de aguas residuales. Aguas arriba se llega a la ciénaga de Juan Lara que se considera una ampliación del Caño Chimalito su principal efluente. Es utilizado por pescadores en algunos tramos sin embargo en el sector sobre el casco urbano caño no es navegable.","Terrestre","Aguas lóticas","Arroyo o riachuelo","Arroyo o riachuelo","Arroyo o riachuelo","9.229200  -75.816700","Pública"
"Cruz de Piedra","Carrera 26 con calle 18","Construido en el año 1950 para según la comunidad “realizar un exorcismo que les diera paz eterna a los protagonistas de un accidente que sucedió en ese lugar” y que según la creencia popular no habían podido lograr el descanso eterno. Según las versiones populares dos compadres no se pusieron de acuerdo para compartir una cabeza de bocachico y luego de la discusión se fueron a los golpes y desenfundando armas blancas dieron muerte el uno al otro al mismo tiempo.  Como en aquel tiempo la vía donde se encuentra era un lugar obligatorio de salida del municipio por el camino real antes de que construyeran las carreteras todo aquel que pasaba por allí manifestaba ver la escena y se horrorizaban con la misma. Luego fue construida la “Cruz de Piedra” y se le dio ese nombre porque los transeúntes arrojaban piedras al sitio y se logró acumular un gran número de ellas alrededor.","Terrestre","Patrimonio Cultural Mueble","Obras en espacio público","Cruz","Cruz","9.238800  -75.812300","Pública"
"Centro Cultural Primitivista Marcial Alegría","C 2 20B 15","El Centro Cultural Primitivista Marcial Alegría es un espacio adaptado en la vivienda de este artista donde se pueden apreciar múltiples pinturas conservadas de distintas etapas de su vida como también otras más recientes para la venta. Junto a las pinturas también se encuentra una amplia muestra de artesanías en barro cocido. Muchas de sus obras recogen la cotidianidad de la comunidad loriquera como corralejas el mercado la calle del pueblo diarios aconteceres como la cocina las bodas la pesca o las lavanderas las cuales han sido expuestas en países como Alemania Italia Francia Suiza entre otros. Cabe resaltar que Marcial Alegría Garcés el más consagrado de los pintores primitivistas y el más representativo de los colombianos que pintan con ese estilo.","Terrestre","Patrimonio cultural material inmueble","Grupo arquitectónico","Arquitectura institucional","Edificación para la cultura","9.226800  -75.788900","Privada"
"Obelisco en Homenaje a la Lengua Castellana","Calle 2 con carrera 24","Este monumento ha sido objeto de obras de urbanismo para mejoramiento integral del entorno. Consta de un obelisco en material de aluminio con una estructura hueca en la que por sus cuatro caras se ven letras del alfabeto árabe en altos relieves que resaltan sobre los elementos verticales del obelisco que se encuentra sobre un pedestal de 80 x 80 centímetros en el que se por sus cuatro caras se observan palabras del idioma español que han sido aportadas por el idioma árabe. El espacio se encuentra sobre un pavimento en adoquines con canecas de basura bancas jardines iluminación nocturna y señalización peatonal al igual que una baranda en madera corrida sobre el borde del Río Sinú y una escalera para el acceso directo desde embarcaciones.","Terrestre","Patrimonio Cultural Mueble","Obras en espacio público","Monumento","Monumento","9.228000  -75.816600","Pública"
